{
  "format": "ofti.bundle-set",
  "format_version": 1,
  "version": 1,
  "name": "mesh-study",
  "cases": [
    {
      "name": "cavity-coarse",
      "archive": "cases/0000-cavity-coarse.ofti.tar.gz",
      "size": 2048,
      "sha256": "aaaaaaaaaaaaaaaaaaaaaaaaaaaaaaaaaaaaaaaaaaaaaaaaaaaaaaaaaaaaaaaa",
      "manifest": {
        "format": "ofti.case-bundle",
        "format_version": 1,
        "version": 1,
        "case_name": "cavity-coarse",
        "start_time": "0",
        "mesh_policy": "auto",
        "application": "icoFoam",
        "header_version": "v2512",
        "files": [],
        "warnings": []
      }
    }
  ]
}
